<?xml version="1.0" encoding="utf-8"?>
<xs:schema xmlns:xs="http://www.w3.org/2001/XMLSchema" elementFormDefault="qualified" attributeFormDefault="unqualified">
    <xs:element name="Mappings">
        <xs:complexType>
            <xs:sequence>
                <xs:element name="Operations">
                    <xs:complexType>
                        <xs:sequence>
                            <xs:element name="add" maxOccurs="unbounded">
                                <xs:complexType>
                                    <xs:attribute name="key" type="xs:string" use="required"/>
                                    <xs:attribute name="value" type="xs:string" use="required"/>
                                </xs:complexType>
                            </xs:element>
                        </xs:sequence>
                    </xs:complexType>
                </xs:element>
                <xs:element name="DataServices">
                    <xs:complexType>
                        <xs:sequence>
                            <xs:element name="Assembly" maxOccurs="unbounded">
                                <xs:complexType>
                                    <xs:sequence>
                                        <xs:element name="NameSpace" maxOccurs="unbounded">
                                            <xs:complexType>
                                                <xs:sequence>
                                                    <xs:element name="Mapping" maxOccurs="unbounded">
                                                        <xs:complexType>
                                                            <xs:attribute name="name" type="xs:string" use="required"/>
                                                            <xs:attribute name="value" type="xs:string" use="required"/>
                                                        </xs:complexType>
                                                    </xs:element>
                                                </xs:sequence>
                                                <xs:attribute name="name" type="xs:string" use="required"/>
                                            </xs:complexType>
                                        </xs:element>
                                    </xs:sequence>
                                    <xs:attribute name="name" type="xs:string" use="required"/>
                                </xs:complexType>
                            </xs:element>
                        </xs:sequence>
                    </xs:complexType>
                </xs:element>
            </xs:sequence>
        </xs:complexType>
    </xs:element>
</xs:schema>
